{
  "_metadata": {
    "owner": "hyeokju98@example.com",
    "sensitivity": "internal",
    "retention_days": 365,
    "created_by_agent": "code-reviewer",
    "created_at": "2026-05-07T15:02:44Z",
    "model": "opus",
    "evidence_methods": ["read"],
    "confidence": {
      "overall": 0.52,
      "method": "self_consistency",
      "low_confidence_fields": [
        "issues[0].severity",
        "issues[1].rule"
      ]
    }
  },
  "run_id": "20260507-1502-payment-flow",
  "changed_files": [
    "apps/payment/services/charge.py"
  ],
  "issues": [
    {
      "severity": "critical",
      "rule": "critical-race-condition",
      "location": {
        "file": "apps/payment/services/charge.py",
        "line": 142,
        "symbol": "deduct_balance"
      },
      "message": "SELECT 후 UPDATE인데 락 미사용. 동시 요청 시 잔액 음수 가능성.",
      "evidence": {
        "method": "read",
        "pattern": "select_for_update 미발견"
      },
      "confidence": 0.55,
      "self_consistency_votes": {
        "n_samples": 3,
        "agreement_ratio": 0.67
      }
    },
    {
      "severity": "warning",
      "rule": "warning-no-exception",
      "location": {
        "file": "apps/payment/services/charge.py",
        "line": 89
      },
      "message": "외부 PG API 호출에 timeout/retry 없음.",
      "confidence": 0.4
    }
  ],
  "summary": "race condition 의심 (3 sampling 중 2 agree). PG 외부 호출 보강 권고.",
  "conclusion": {
    "status": "needs_fix",
    "rationale": "Critical 의심 항목은 사용자 검토 후 확정. low_confidence_fields 표시됨."
  }
}
