{
  "_metadata": {
    "owner": "hyeokju98@example.com",
    "sensitivity": "internal",
    "retention_days": 365,
    "created_by_agent": "code-reviewer",
    "created_at": "2026-05-07T14:23:11Z",
    "model": "opus",
    "evidence_methods": ["read", "grep"],
    "confidence": {
      "overall": 0.92,
      "method": "evidence_density",
      "low_confidence_fields": []
    }
  },
  "run_id": "20260507-1423-password-policy",
  "changed_files": [
    "apps/auth/services/password.py",
    "apps/auth/views.py"
  ],
  "issues": [
    {
      "severity": "critical",
      "rule": "critical-sql-injection",
      "location": {
        "file": "apps/auth/views.py",
        "line": 87,
        "symbol": "search_users"
      },
      "message": "f-string으로 쿼리 빌드. 파라미터 바인딩으로 변경.",
      "current": "cursor.execute(f\"SELECT * FROM users WHERE email='{email}'\")",
      "proposed": "cursor.execute(\"SELECT * FROM users WHERE email=%s\", [email])",
      "evidence": {
        "method": "grep",
        "pattern": "cursor.execute\\(f"
      },
      "confidence": 0.95
    }
  ],
  "architecture_alignment": {
    "fits_layer_pattern": true,
    "follows_conventions": true
  },
  "summary": "비밀번호 정책 강화 정상. SQL injection 1건 Critical.",
  "conclusion": {
    "status": "needs_fix"
  }
}
